{
  "meta": {
    "artifact_name": "growth_evaluation_report",
    "artifact_version": "0.1.0",
    "producer": "Growth Evaluation Agent",
    "workflow_step": 14,
    "workflow_version": "V2",
    "brief_id": "brief_demo_action_camera_001",
    "project_name": "E-commerce Growth Agent Studio",
    "project_name_cn": "电商增长 Agent 工作台",
    "product_name": "运动相机",
    "status": "needs_review",
    "created_at": "2026-07-15T20:54:00+08:00",
    "summary": "Step 14 evaluated workflow capability, data quality, gate correctness, risk propagation, and issue attribution. Because there is only one completed demo case and several metrics are mock, estimated, or not available, the overall evaluation status is needs_review rather than pass."
  },
  "evaluation_scope": {
    "evaluates": [
      "Agent workflow completion and artifact structure",
      "Planner routing and downstream handoff quality",
      "Brand Compliance risk detection and blocked gate propagation",
      "Human Approval inheritance and release gate correctness",
      "Metric data availability and source classification",
      "Failure taxonomy, issue attribution, and iteration recommendations"
    ],
    "does_not_evaluate_as_real_business_results": [
      "CTR uplift",
      "CVR uplift",
      "GMV growth",
      "traffic growth",
      "conversion uplift"
    ],
    "not_responsible_for": [
      "final marketing copy",
      "final image prompt",
      "image generation",
      "frontend page",
      "public release",
      "V2 Final Report Generator"
    ],
    "source_files_read": [
      "PROJECT_MEMORY_FOR_OPENCLAW.md",
      "README.md",
      "FILE_INDEX.md",
      "workflow/agent_workflow.md",
      "workflow/agent_io_contracts.md",
      "outputs/planner_execution_plan.json",
      "outputs/brand_compliance_report.json",
      "outputs/human_approval_record.json",
      "outputs/growth_metrics_plan.json",
      "outputs/final_creative_package_report.json",
      "docs/evaluation_metrics_test_plan.md",
      "data/evaluation_metrics_sample.csv",
      "data/audit_log_sample.json"
    ],
    "step_boundary_confirmation": {
      "steps_1_to_13_completed": true,
      "step_13_status": "needs_revision",
      "structured_planning_can_enter_evaluation": true,
      "final_generation_allowed": false,
      "public_release_allowed": false,
      "demo_product_name_rule": "Use only 运动相机 as the demo product name."
    }
  },
  "data_quality_summary": {
    "overall_data_quality": "partial",
    "completed_demo_cases": 1,
    "pending_demo_cases": 2,
    "measured_sources_available": [
      "Current workspace artifact existence and JSON parse validation",
      "Human Approval release gate fields",
      "Brand Compliance risk item list",
      "Mock audit log event count"
    ],
    "mock_or_estimated_sources_available": [
      "data/evaluation_metrics_sample.csv",
      "docs/evaluation_metrics_test_plan.md"
    ],
    "not_available_sources": [
      "real campaign delivery logs",
      "real customer CTR/CVR/GMV/traffic/conversion results",
      "manual field-level review annotations",
      "unsupported-claim audit sample with counted denominator",
      "real per-node runtime logs for Steps 1-13"
    ],
    "data_source_type_rules": {
      "measured": "Supported by current artifact presence, JSON validation, explicit release gate values, or counted records in current files.",
      "derived_from_mock": "Calculated from demo CSV or mock audit log, not production data.",
      "estimated": "Taken from demo baseline assumptions; must not be called real efficiency improvement.",
      "not_available": "No reliable denominator or real annotation exists yet."
    }
  },
  "benchmark_cases": [
    {
      "case_id": "case_001",
      "product_name": "运动相机",
      "category": "智能影像设备",
      "status": "completed_demo",
      "mvp_nodes_completed": "11/11",
      "v2_governance_coverage": {
        "planner_agent": "completed",
        "human_approval_node": "completed_needs_revision",
        "growth_evaluation_agent": "completed_in_this_step"
      },
      "data_source_type": "derived_from_mock",
      "notes": "唯一已执行完整 Demo；11/11 仅代表原 MVP 核心节点完成率。"
    },
    {
      "case_id": "case_002",
      "product_name": "便携投影仪",
      "category": "消费电子",
      "status": "pending",
      "mvp_nodes_completed": "0/11",
      "v2_governance_coverage": {
        "planner_agent": "not_run",
        "human_approval_node": "not_run",
        "growth_evaluation_agent": "not_run"
      },
      "data_source_type": "not_available",
      "notes": "未提供 Brief，不能伪造结果。"
    },
    {
      "case_id": "case_003",
      "product_name": "美妆精华",
      "category": "美妆个护",
      "status": "pending",
      "mvp_nodes_completed": "0/11",
      "v2_governance_coverage": {
        "planner_agent": "not_run",
        "human_approval_node": "not_run",
        "growth_evaluation_agent": "not_run"
      },
      "data_source_type": "not_available",
      "notes": "未提供 Brief，不能伪造功效宣称风险测评结果。"
    }
  ],
  "metric_results": [
    {
      "metric_id": "metric_001",
      "metric_name": "任务完成率",
      "value": "11/11 for original MVP core nodes; V2 governance nodes 3/3 covered for the 运动相机 demo after Step 14",
      "data_source_type": "derived_from_mock",
      "calculation_basis": "CSV case_001 has completed_nodes=11 and expected_nodes=11; Planner/Human Approval/Growth Evaluation are counted separately as V2 governance coverage.",
      "interpretation": "原 MVP 单案例跑通；不能外推为跨品类稳定。"
    },
    {
      "metric_id": "metric_002",
      "metric_name": "平均耗时",
      "value": "90-150 minutes Agent workflow estimate vs 360-600 minutes manual baseline estimate",
      "data_source_type": "estimated",
      "calculation_basis": "CSV demo estimates only; no real timestamped execution logs for all nodes.",
      "interpretation": "只能作为作品集假设，不能写成真实效率提升。"
    },
    {
      "metric_id": "metric_003",
      "metric_name": "人工修改率",
      "value": null,
      "data_source_type": "not_available",
      "calculation_basis": "human_edit_rate_mock is TBD and no field-level manual annotation exists.",
      "interpretation": "需要人工抽检字段后计算。"
    },
    {
      "metric_id": "metric_004",
      "metric_name": "幻觉率",
      "value": null,
      "data_source_type": "not_available",
      "calculation_basis": "hallucination_rate_mock is TBD; unsupported_claim numerator and claim denominator not yet annotated.",
      "interpretation": "当前只能说明 blocked gate 控制了无证据声明风险，不能量化幻觉率。"
    },
    {
      "metric_id": "metric_005",
      "metric_name": "合规阻断率",
      "value": "6 high-risk blocked/mock CSV items; 2/7 Human Approval items blocked; 8 Brand Compliance risk items identified",
      "data_source_type": "derived_from_mock",
      "calculation_basis": "CSV compliance_blocked_items=6; Human Approval blocked items=2/7; Brand Compliance risk items=8.",
      "interpretation": "可证明阻断机制存在，但跨案例阻断率仍需更多样本。"
    },
    {
      "metric_id": "metric_006",
      "metric_name": "结构化输出率",
      "value": "Step 14 produced JSON and Markdown; prior completed nodes have structured artifacts recorded in FILE_INDEX",
      "data_source_type": "measured",
      "calculation_basis": "Current workspace artifact creation and index inspection.",
      "interpretation": "结构化输出习惯良好；仍需后续 schema 自动化测试覆盖。"
    },
    {
      "metric_id": "metric_007",
      "metric_name": "可追踪率",
      "value": "audit log sample has 3 trace events; current reports preserve source_files/input artifacts",
      "data_source_type": "derived_from_mock",
      "calculation_basis": "data/audit_log_sample.json contains 3 mock audit events and current artifacts include inputs_used/source_files.",
      "interpretation": "具备可追踪设计；不是生产级审计证明。"
    },
    {
      "metric_id": "metric_008",
      "metric_name": "审批闸口正确率",
      "value": "Release gates correctly inherited: structured planning approved; final copy/prompt/image/public release blocked",
      "data_source_type": "measured",
      "calculation_basis": "outputs/human_approval_record.json release_gates and this report release_gates match required states.",
      "interpretation": "审批继承正确。"
    },
    {
      "metric_id": "metric_009",
      "metric_name": "风险传递完整率",
      "value": "Critical risk classes from Brand Compliance and Human Approval are present in issue_list and release gates",
      "data_source_type": "measured",
      "calculation_basis": "Brand risks cover technical/performance claims, AI effect, business result claims, asset authorization, competitor comparison, visual exaggeration, and positioning.",
      "interpretation": "核心风险已传递；仍需字段级 trace matrix 自动化。"
    },
    {
      "metric_id": "metric_010",
      "metric_name": "失败原因可解释性",
      "value": "9 failure categories defined; issue list includes evidence, root cause, actions, owner and verification method",
      "data_source_type": "measured",
      "calculation_basis": "failure_taxonomy and issue_list in this artifact.",
      "interpretation": "具备解释框架；需要更多失败样本验证稳定性。"
    }
  ],
  "rubric_results": [
    {
      "rubric_id": "rubric_001",
      "dimension": "输入完整性",
      "score": 0.78,
      "score_scale": "0-1",
      "data_source_type": "measured",
      "evidence": "Required Step 14 inputs are present; proof materials and asset authorization are missing.",
      "status": "needs_review"
    },
    {
      "rubric_id": "rubric_002",
      "dimension": "Planner 路由正确性",
      "score": 0.86,
      "score_scale": "0-1",
      "data_source_type": "measured",
      "evidence": "Planner routes Brand Compliance before Human Approval and Growth Evaluation after compliance and approval.",
      "status": "pass_with_caution"
    },
    {
      "rubric_id": "rubric_003",
      "dimension": "上下游字段交接完整性",
      "score": 0.8,
      "score_scale": "0-1",
      "data_source_type": "measured",
      "evidence": "Planner, Human Approval, and Brand Compliance expose handoff fields; some future_outputs labels remain historical placeholders.",